{
  "artifactKind": "graphentra-evidence",
  "schemaVersion": "2.0",
  "analyzerVersion": "0.4.0",
  "target": {
    "targetPath": "."
  },
  "comparison": {
    "mode": "working-tree",
    "resolvedBaseSha": "aa315724a0400f9c90cf39b3f12d441330cef5dd",
    "comparedTo": "the working tree"
  },
  "sourceState": {
    "checkoutSha": "aa315724a0400f9c90cf39b3f12d441330cef5dd",
    "isTrackedDirty": true,
    "untrackedSourcePolicy": "included",
    "contentIdentity": "d2110743450a142738612ec572f9976d5a2fc58be01d6c38e5062d709796ed48"
  },
  "options": {
    "excludePaths": [],
    "sourcePolicy": "git-tracked-and-nonignored-untracked"
  },
  "outcome": "no_supported_changes",
  "technicalGraph": {
    "schemaVersion": "1.0",
    "repository": {
      "targetPath": ".",
      "headSha": "aa315724a0400f9c90cf39b3f12d441330cef5dd",
      "analyzerVersion": "0.4.0"
    },
    "capabilities": {
      "language": "typescript",
      "entityKinds": [
        "function"
      ],
      "relationTypes": [
        "CALLS"
      ],
      "maxBlastDepth": 6
    },
    "analyzedFiles": [
      "a.ts"
    ],
    "entities": [
      {
        "id": "a.ts#callee",
        "kind": "function",
        "name": "callee",
        "file": "a.ts",
        "startLine": 1,
        "endLine": 3
      },
      {
        "id": "a.ts#caller",
        "kind": "function",
        "name": "caller",
        "file": "a.ts",
        "startLine": 4,
        "endLine": 6
      }
    ],
    "relations": [
      {
        "from": "a.ts#caller",
        "to": "a.ts#callee",
        "type": "CALLS"
      }
    ]
  },
  "changedFiles": [
    {
      "file": "a.ts",
      "oldFile": "a.ts",
      "changedLines": [
        7
      ],
      "addedCode": [
        "export const unsupported = 1;"
      ],
      "removedCode": [],
      "diff": "diff --git a/a.ts b/a.ts\nindex 1aa8100..35762c2 100644\n--- a/a.ts\n+++ b/a.ts\n@@ -4,3 +4,4 @@ export function callee() {\n export function caller() {\n   return callee();\n }\n+export const unsupported = 1;",
      "hunks": [
        {
          "lines": [
            {
              "kind": " ",
              "code": "export function caller() {",
              "oldLine": 4,
              "newLine": 4
            },
            {
              "kind": " ",
              "code": "  return callee();",
              "oldLine": 5,
              "newLine": 5
            },
            {
              "kind": " ",
              "code": "}",
              "oldLine": 6,
              "newLine": 6
            },
            {
              "kind": "+",
              "code": "export const unsupported = 1;",
              "oldLine": 7,
              "newLine": 7
            }
          ]
        }
      ]
    }
  ],
  "changedEntities": [],
  "impacts": [],
  "diagnostics": [
    {
      "code": "NO_SUPPORTED_CHANGES",
      "severity": "warning",
      "message": "Changes did not match supported current function declarations. This is not a no-risk result."
    }
  ],
  "limitations": [
    "Only TypeScript is analyzed.",
    "Only named standalone function declarations are supported.",
    "Only CALLS relationships are currently supported.",
    "Class methods are not analyzed.",
    "Arrow functions are not analyzed.",
    "Dynamic calls are not analyzed.",
    "Deleted functions have no current graph entity; renamed or ambiguous functions may lack removed-code evidence.",
    "Overlapping function line ranges are skipped rather than sharing ambiguous evidence.",
    "Application surfaces are not yet discovered.",
    "Blast radius is limited to depth 6."
  ]
}
